{"access_date":"2026-10-12","archival_location":"raw/mtgjson/cc2-token-physical-pairing/56ff9fb31b47b2c42be1da203d94c96c05c85d2dd66d549765e87327ab6fd193/payload.bin","claims":["Exact published source bytes and pinned provider metadata; identity claims remain pending independent human review."],"content_hash":"sha256:56ff9fb31b47b2c42be1da203d94c96c05c85d2dd66d549765e87327ab6fd193","id":"mtgjson-cc2-token-physical-pairing-56ff9fb31b47","notes":"MIT license retained. Retrieval timestamps do not establish source publication or market observation times.","provider":"MTGJSON","record_version":"6bde64122026eb7e65c21db028e34f4cb42b5305","schema_version":"v1","source_classification":"community","source_location":"https://github.com/mtgjson/mtg-sealed-content/blob/6bde64122026eb7e65c21db028e34f4cb42b5305/outputs/token_products_mappings/CC2.json","title":"token-products-CC2.json","verification_status":"supported"}