{"access_date":"2026-10-14","archival_location":"evidence/fixture-source.txt","claims":["Defines only this fictional Card and Printing for documentation tests."],"content_hash":"106a40a900af2dee7e257ca8ff659348213391df3a2cd2e67cabcb005aae3330","id":"fixture-source","notes":"Not provider acquisition, production approval or user inventory.","provider":"Original MTG Lab test fixture","record_version":"fixture-v1","schema_version":"v1","source_classification":"internal","source_location":"urn:mtg-lab:original-fictional-fixture","title":"Original fictional documentation evidence","verification_status":"confirmed"}
