{"access_date":"2026-10-14","archival_location":"raw/wizards/wizards-fan-content-current/4592d12dfc02d52681b8b77b56ea5e4ff62cd82609067f05df2ba4fd2c202d05/payload.bin","claims":["The policy conditionally permits original fan creations shared freely, including websites and personal enjoyment. It requires unofficial attribution, existing notices, respect for third-party rights and compliance with Wizards terms, and excludes verbatim copying/reposting and specified mechanics/logos/trademarks. Donations, advertising and sponsorship may support qualifying free content subject to conditions; paid access, sales and compensated licensing need additional permission. It is not blanket authorization for this verbatim source-derived database or an unspecified future service."],"content_hash":"4592d12dfc02d52681b8b77b56ea5e4ff62cd82609067f05df2ba4fd2c202d05","id":"wizards-fan-content-current","notes":"Hash binds the retained projection/summary, not the full upstream webpage. Supported observation does not grant admission or complete source-policy clearance.","provider":"Wizards of the Coast","publication_date":"2017-11-15","record_version":"1","schema_version":"v1","source_classification":"official","source_location":"https://company.wizards.com/en/legal/fancontentpolicy","title":"wizards fan content current","verification_status":"supported"}
