{"access_date":"2026-10-14","archival_location":"raw/wizards/wizards-general-terms-current/16e13ba185a610dba472212f5badcc4466c43e3cc74345f1292c12172865c6ea/payload.bin","claims":["The terms grant revocable individual noncommercial use of Wizards websites/services, reserve Game Content rights, and restrict unauthorized extraction, reproduction and exploitation. They defer expressly permitted fan uses to the Fan Content Policy. This does not establish a database-reuse license for the provider-derived records; it is not a finding that these website terms automatically govern all third-party API processing."],"content_hash":"16e13ba185a610dba472212f5badcc4466c43e3cc74345f1292c12172865c6ea","id":"wizards-general-terms-current","notes":"Hash binds the retained projection/summary, not the full upstream webpage. Supported observation does not grant admission or complete source-policy clearance.","provider":"Wizards of the Coast","publication_date":"2025-12-10","record_version":"1","schema_version":"v1","source_classification":"official","source_location":"https://company.wizards.com/en/legal/terms","title":"wizards general terms current","verification_status":"supported"}
