{"access_date":"2026-10-12","archival_location":"raw/mtgjson/cc2-license/a78bab0667e57b25b91b3e037f6856fe20fbe01a091c7c525be292d8a834283b/payload.bin","claims":["Exact published source bytes and pinned provider metadata; identity claims remain pending independent human review."],"content_hash":"sha256:a78bab0667e57b25b91b3e037f6856fe20fbe01a091c7c525be292d8a834283b","id":"mtgjson-cc2-license-a78bab0667e5","notes":"MIT license retained. Retrieval timestamps do not establish source publication or market observation times.","provider":"MTGJSON","record_version":"6bde64122026eb7e65c21db028e34f4cb42b5305","schema_version":"v1","source_classification":"community","source_location":"https://github.com/mtgjson/mtg-sealed-content/blob/6bde64122026eb7e65c21db028e34f4cb42b5305/LICENSE.txt","title":"LICENSE-MTGJSON.txt","verification_status":"supported"}