{"access_date":"2026-10-15","archival_location":"evidence/original-fictional.txt","claims":["Defines fictional fixture identities, not provider facts or physical ownership."],"content_hash":"cb3de7fc1aed6d0920638a028a6f5c0abc009b085df614115e8fe663bda05d2c","id":"original-fixture","provider":"Original fictional fixture","record_version":"fixture-v1","schema_version":"v1","source_classification":"internal","source_location":"urn:mtg-lab:fictional:clockwork","title":"Original fictional evidence","verification_status":"confirmed"}
