{"access_date":"2026-10-15","archival_location":"evidence/original-fictional.txt","claims":["Defines fictional fixture identities, not provider facts or physical ownership."],"content_hash":"b7b9fe09cdae60d5ccd2a3727d71bc91173520413fea86b6a78db298628e1c75","id":"original-fixture","provider":"Original fictional fixture","record_version":"fixture-v1","schema_version":"v1","source_classification":"internal","source_location":"urn:mtg-lab:fictional:lantern","title":"Original fictional evidence","verification_status":"confirmed"}
