{"access_date":"2026-10-14","archival_location":"raw/scryfall/scryfall-access-faq-current/307c63919c9e38d4563d4815378afee59d300232e0053ab3b0385af488878634/payload.bin","claims":["The FAQ directs heavy lookup users to bulk downloads and expressly supports processing those files on their own systems. Its footer attributes literal/graphical Magic information to Wizards, calls portions unofficial fan content, and reserves other content to Scryfall. It requires restrained API traffic and well-formed HTTPS requests. This is operational guidance for local bulk processing, not an explicit public redistribution grant for the collection-API projection or complete rights chain for the proposed records."],"content_hash":"307c63919c9e38d4563d4815378afee59d300232e0053ab3b0385af488878634","id":"scryfall-access-faq-current","notes":"Hash binds the retained projection/summary, not the full upstream webpage. Supported observation does not grant admission or complete source-policy clearance.","provider":"Scryfall","record_version":"1","schema_version":"v1","source_classification":"official","source_location":"https://scryfall.com/docs/faqs/i-m-having-trouble-accessing-the-scryfall-api-or-i-m-blocked-17","title":"scryfall access faq current","verification_status":"supported"}
